timestamp,speaker,words,tags,
,Rebecca Scofield,"This is Rebecca Scofield and I am here with Patrick Terry and its October 21st, 2017, and we're at the World Gay Rodeo Finals in Albuquerque, New Mexico. Can you tell me when you were born?",,
,Patrick Terry,"Yes, November 25th, 1957. I celebrate my 60th birthday next month.",,
,RS,Congratulations!,,
,PT,"Yes, I am treating myself to a cruise.",,
,RS,That's gonna be amazing. So where were you born?,,
,PT,"Denver, Colorado.",childhood,
,RS,And...,,
,PT,"Born and raised on the west side, graduated from Almeida High School, and then went on to college and graduated from CU. I have a bachelors in PR and business management.",childhood,
,RS,"So the area you grew up in, was it pretty urban?",childhood,
,PT,"Yes, yes.",childhood,
,RS,Did you grow up as a city kid?,childhood,
,PT,"No. People might say I did it but I didn't 'cause even though I didn't have my own horse, I had people that had them and so I was constantly riding.",childhood,
,RS,Were you pretty horse cray as a kid?,childhood,
,PT,Yes I was. Always have been and still am.,childhood,
,RS,When did you first learn to ride?,childhood,
,PT,"Oh gosh, I would say probably about when I was about 6, 7 years old I first rode and I then I knew. I knew then, and still do, that I love it... So then, you know, through highschool, our highschool didn't offer an equine type of program like that, so I went into the program called the Westernaires, which is a professional riding, I mean kids riding group, that puts on a show for public events.  And when I was in it there was about 15, no there was about 500 people in it, and now there's 2,500.",childhood,
,RS,"Oh, wow.",childhood,
,PT,Yea.,childhood,
,RS,"And to do that, did you have to have your own horse?",childhood,
,PT,"No. And see, I was fortunate enough that my father's boss had a horse and so I was able to do it. But of the four kids, I was the only one who took an interest in doing it, and so I did it and everything else and then, you know, had my own horse for a while and then sold it for different reasons, various finacial and everything. But I always have had that passion to ride and be a part of rodeos and everything else. And so then, I came out as a gay man in 1987 and right away jumped right into it into the western lifestyle and gay rodeo and have gone on from there.",childhood;parents;comingout,
,RS,"And so, when did you first know you were gay?",comingout,
,PT,"Very interesting question, because people a lot of people will say you're born with it. I don't believe that at all. I have gone through two engagements to women and it was during my year that I travelled in Up With People, which is a singing/performing group that travels all over the world, I did that and was a staff member also one year, that I started having feelings because, you know, a lot of times we'd share, 'cause we stayed with host families wherever we went, so a lot of times we'd share a bed with another handsome man. You know, 85% of the men in Up With People are gay because its theater and production and so I started having these feelings and then I was so scared because my brother, my little brother, was gay. And it all came out when he was 16 and it wasn't good- he got caught fooling around in the park, got arrested, you know. My dad had to go bail him out. My dad bailed him out and then kicked him out of the house and wanted nothing to do with him. And so he grew up. And I have always said, he paved the path for me to be able to come out because it was so much easier for me to come out. My father never knew that I was before he passed away but my mom, I told her right away. I said, you know, this is it, I am this. ",comingout;jobs;family;parents;homophobia,
,PT,"And, I mean, my brother had seen me working at a gay bar -he came for the grand opening of this one particular bar- and I was bartending and it was kind of, kind of... not a real good thing but he, rather than talk or say anything, he goes and stands right in front of the register where I was bartending, he and his partner, all night. And so, then he brings it up at thanksgiving, that I have this. And he says you know, what's your extra job that you're doing? 'Cause at the time I was working in retail. At that time I was store, I mean department manager, for the entire mens' department of Bradburry Southwest. I had seven departments in one, 55 employees, 3 assistants, and it was a multimillion dollar business a year. It was big. I was the first one with that company to ever have multiple departments. So I was working there and doing that and then I started, you know, going to gay bars and then all of a sudden they're asking me, ""you wanna bartend?"" and everything and so I did. I went to Charlie's and in 1987, it was probably in August or September, and, right away, they were in the process of moving downtown from the Aurora area, they said, ""you wanna work here?"" and I helped put the new bar together and everything else. Which, ironically was the same place where I went to my senior highschool homecoming dinner. It used to be a restaurant called Emerson Street East. And it's ironic to go back into that building and I was bartending, DJing, waiting, bar backing, and everything.",comingout;jobs;family,
,PT,"And so, after I'd left the other bar and went on with Charlie's, then it was after that because the owner, the general manager, he was one of the founders: Wayne Jakino, he was one of the founders of IGRA and CGRA. Actually, CGRA first and then IGRA. He pushed me into getting more involved. I went to my first rodeo in Phoenix, Arizona, finals rodeo, in 1987 and had a great time and everything else, and I said, ""this is it, I want to"" so I did. And I got in. And so in 1988, I joined CGRA and from there the general manager continued to push me into a position that he had helped create for the international, which was the administrative assistant, and so I took over for a guy that got sick and eventually died of AIDs. I took over 1993, worked in the office as the administrative assistant for 10 years 'till 2003 and then resigned from that for other reasons, you know, which probably aren't so important. But I did that and have been involved basically with gay rodeo since 1988. Have been rodeo director of Denver's rodeo twice, I've been finals rodeo director, can't remember what year... 2013. How can I forget that? 2013 I was finals rodeo director in Fort Worth, Texas, and have served on various committees, not only at CGRA level but also IGRA level. I've been trustee for CGRA twice and have done other things, committees and everything else. Then in 2000... gosh, sorry can't remember, either 2013 or 2012. I think it was 12, I was inducted into the hall of fame. I found out that I was not only nominated once but twice in the same year. The first year that I was nominated I went in as into the hall of fame. It's very dear to me. It's an honor. It's, you know, means a lot. And I've served on that committee and everything else but I had to recuse myself because I was on the committee at the time I was nominated. So the chair said that I had back out of it during the process of them deciding who was gonna make it. And so, I believe it was in 2012, was at convention in Las Vegas, my rodeo mom and dad and my real mom, sister, and her husband came to it and supported me during this time of recognition and everything and so...",jobs;family,
12:12,RS,"So can I ask, going back, what year did you travel with people.",jobs,
,PT,84 and 85,jobs,
,RS,84 and 85 so it was right around there that you came out,comingout,
,PT,"It was after, basically it was towards the end of it in 85 and I was scared at first I saw what my brother had gone through and I was so scared that I stayed in the closet for 2 years before coming out in 1987",comingout,
,RS,And did anything particularly draw you to Charlie's sort of the country western side?,,
,PT,"I loved the music I loved the dancing I loved the animals and through the years I've done various things with IGRA including one of them I was score keeper for several years I did it but i didn't really I didn't like it cause it took me away from the contests and during the 10 years that I was the administrative assistant I worked directly with the contestants and that to me was the thing and so now that I've taken a couple of years of and come back today reassured me I belong with the contests not up in the both but back there so I pulled gates did the gates for the speed events for the horse contests and everybody was really excited to see me, not only see me back cause I've been gone for 2 years but that I was wanting to volunteer I said it's just I can't just sit there and watch there is no way I can go and sit in an audience and not participate",,
,RS,So at the very first rodeo you went to did you compete or did you just watch?,,
,PT,Nope I just watched,,
,RS,What did you think?,,
,PT,"I was hooked, I was hooked and ready to start competing, and started competing in 1988",,
,RS,And what events did you compete in?,events, 
,PT,"I did calf roping on foot, wild drag, steer deco, goat dressing, chute dogging, steer riding, and bull riding, and I competed from 1998 I started competing right away and I competed until I think it was about 1994 95 and then I went into the certification I was getting too old it was too hard to come back from the injuries and at that time we had 20 25 rodeos a year and sometimes we had rodeos that were back to back and so it was hard to recuperate and then go do it again but its it was something I always wanted my mother refused to come watch she I think she supported me she just didn't want to see me you know get hurt. I had my injuries I definitely did broke both collar bones almost every rip and got stepped on and you know its still. Been thinking about it when I started to get back involved with CGRA I started thinking about that I would love to one time go back and steer ride, so possible next year I'm going to do it, just do it one time just satisfy my craving for it because it just it, it is so hard to explain people ask how can you ride a bull and it's so hard to describe because it's in that moment it is the biggest thrill you could ever have and that I always said I'd never dod broncs its too high it's a lot higher up that to fall but drawback is broncs usually don't come back after you and bulls do, only thing I ever really retained I mean injury I had from bull riding was broken collarbone simple fluke fell off and landed on my shoulder and it broke. ","events, injuries",
,RS,What were those early rodeos like in the 80's,,
,PT,"Oh my gosh, very well attended, I mean you could go to the LA rodeo and I am not kidding you, there were 10 thousand people a day partying out dancing watching the rodeo all these other things and I mean it was just, we were just thriving and there were 20, 20 to 25 rodeos a years we had up to 28 associations at one time in IGRA and it was really going really strong I mean pool parties at the San Diego rodeo you just did not want to miss and so it was all this but the most important thing at all of this and I realized this after being gone for 2 years was the camaraderie and the friends. You meet friends that become your family and  you know you really do care about them it's not that I don't care about my immediate family but these people mean a lot to me, they do, and I have a lot of people yesterday and today it's wonderful to see me back and you know that truly really do love me and are excited that I'm back at",,
,RS,And you mentioned your rodeo mom and dad whose that?,family,
,PT,"Turned out to be, it was the funniest thing because I was a certified scorekeeper and at the Chicago rodeo I got invited to be the score keeper and this rodeo was on facility I mean on the grounds of this couple's home their, one of their sons lived across the driveway and everything but then they had their own full arena back there and everything else, when I first went in and met her and everything she thought I was the most pretentious queen that she'd ever seen and it was so funny but we, grew to be so close, so close I just, and when I was inducted into the hall of fame she came to Las Vegas and  she broke the news to me that she had cancer, and she fought it for about a year and passed away and it was a very very devastating to me it was very it was so hard I just can't even imagine and I, I lost my father but my father and I weren't really close after my parents divorced because I was involved with caught him cheating on her and everything and then I had to help her out when filed for divorce and moved out because she had never had a job cause she raised us 4 kids and all a sudden she's in a 5 bedroom home and had to pay utilities since he had taken out checking account",family,
,RS,How old were you when that happened?,family,
,PT,"Let's see I was... tring to think... I would say maybe, 79 or 80 1980 but still nothing ya they'd been married 28 years we had us 4 kids had [ut on this huge for them for their 25th anniversary my parents traveled through my father's business he was able to win these trips to, they traveled all over the place they went on a trip to portugal went home mom said everything was fine and then he didn't come home that night he insisted on going bowling and sure enough, I was the one who caught him doing the whole thing and that was devastating to me so after that my father and I did not speak and we had no communication with each other",family,
,RS,And when did he pass?,family,
,PT,"He passed in 1995 I think, no he passed in 1991 cause my brother passed away in 1995 of AIDs. He was, it was really interesting cause I am HIV positive myself but I am in no danger I have never been in danger because I accepted it and I dealt with it, my brother little brother was in total denial of that AIDs and him and his partner, his partner had all these holistic views about saving, so it was very difficult cause when he did get sick he was so sick he went in the hospital and 18 days later he's gone being in the hospital being fed intravenously and he's losing a pound and a half a day just deteriorating away. I had to educate my entire family on what exactly was going on, they couldn't understand how I could be HIV positive but he was in full blown AIDs, full blown AIDs, his T cell count was 5 when he went in. THey thought he had tuberculosis but then, my brother had been tested somewhere don't know exactly where but he used his social security so when he died we got the death certificate his partner really got upset because it put it in on there information they have to that he had been HIV positive for 10 years and full blown AIDs for 18 days that he was in the hospital and so you know it was really difficult so I'm educated and my family on what is going on with my brother deteriortating like that and I just had to say it but in his final days we spent a lot of time together which we had never been real close cause he always kinda despised me cause he was right behind me and I accelerated in school and he didn't and the teacher expected the same out of him that they got out of me, it was difficult, he actually attempted suicide once blaming me and so it was rough road but those probably 15 of those 18 days, him and I had a lot of talk a lot, you know, about each other and everything so at least I got to go away with that. But he, survived. ",family,
,RS,"And does your, how did your mother cope with that with the same child",family,
,PT,"She did very well and she does very well with things like that, I know deep down it was really difficult but as far as the level I was the most devastated because I was scared to death that this is what is gonna happen with me but I accepted when I found out I was HIV positive which was in 1995, yes. I was on a study for HIV negative people and my test results came back positive, and people say different things they used to say you could contract it and everything else and I know exactly what happened I know when and strictly mine the nurse was just astonished she could not belive it so she had me come in and do another blood test cause she thought it was a false positive and it turned out it wasn't but my T cells have never ever been below 500, I started taking medicine when they were between 5 and 7 hundred and I have applied, and my T cells are currently around 900 to 1100 range and so its, the disease is there it doesn't go away but you have to accept it and you have to move on with it. and I've learned and elt really good about some things that have happened in my life becoming gay coming out and becoming HIV positive I don't look at it as a bad thing it's something that's happened but with research and everything else and I participated in a lot of studies here in colorado at the University of Colorado I'm involved with studies they call me all the time and do these studies so they can work on trying to get, they're never gonna find a cure but being able to control it. I was very, excuse me, very lucky when I started taking meds AZT was very there was very little AZT in the meds and I have only in my 20 years 15 or 20 years now I have been, I've been 2 different kinds of medicine and I currently only take 2 pills a day. I take in the evening and ones a booster and the other one is and that's what has really kept me in line and through all these other medical issues that have come i have crohn's disease barrett's esophagus high cholesterol I take 38 pills a day, but you know what, it's kept me alive, it's kept me here and I have resisted that to the",family,
,RS,How do you think your rodeo family has helped through you're various health struggles?,,
,PT,"Oh I mean everybody's so supportive because, this association is very unique in we don't do rodeo for a living none of the contestants you know you can't by the time you do all your expenses and everything else throughout the year and especially if you have a horse, you go into it knowing you're gonna lose money but there's more to it than that and that's why our rodeos and the umbrella IGRA association all proceeds go back to charity, and that's we do, that's why we do this, to be able to give money back to charities.",,
,RS,"So you said earlier that you remember Wayne pretty well, what was it like working with him I heard he was very enthusiastic about, IGRA and in general, what was it like working for him?",mentor,
,PT,"He was, and he pushed and pushed and pushed me cause he did, we traveled together went to rodeos together and everything and he gave me a lot of work favors you know and everything else so that I could go to these rodeos and all these other stuff and he was just like a dad to me and, it was very devastating when he passed away, passed away from pancreatic cancer and that was very difficult once again for me but his, ideas and his creativity continues to live he's very proud I know he's very proud, I know when he died he was very proud that he had created this and watched it grow to where it got and you know we struggled in the last few years we've struggled because financially it's diccicult it's becoming more and more difficult to find sponsors because sponsors look at it as butts in the seats and we can have as many contestants as we want but its so that's the big deal and we can't our rodeos are very recreationally none of our contests make a living off of it they all have other jobs and do other things so it's very recreational but we do it because we give the money to charities and we feel good and the camaraderie that you create that you become a part of at the rodeos is it's indescribable and I found out when I had to take these last 2 years take a break, I really found out how much it really is in me and how much I missed it and I really missed the contestants and being here this weekend and being at a I was a timer ein the rodeo and I couldn't I can't just sit in those stands and watch the rodeo I got to be  doing something so I volunteered to come back behind the chutes behind the alleyway and help with the arena directors with speed events and pulling boots got me right back with the contestants because when I was a score keeper you're isolated into a different spot so you don't get that and just I miss that so much because I become so close to the contestants when I was in the office I just  become so close to them and you know, confided in them they confided in me and it really was a family and I miss that when I went up into a scorekeeper because I was isolated up there's so I I retired as a scorekeeper in 20... lets see it would have to have been about 2011 I retired and at the FLorida rodeo was my last rodeo they gave me a bifold send off and everything else and I said I'm not going away I'm just retiring and the reason I was retired was because I had been diagnosed with parkinson's and my writing was very difficult and I did not want to subject a contestant to a wrong score because the secretary or the auditor couldn't read it so I took that step but I found myself I think cause I'm ?? I like so much being with the contestants I found myself going to becoming barn manager and this turned out to be a total fluke, I had gone to the Oklahoma rodeo and I was supposed to be scorekeeper and I came in a day early and I stayed with the rodeo director and then helped him set up well he needs to go to a VIP party on the thursday night and he didn't know how he was gonna be able to do it cause these continents were starting to come in and I said I'll do it it can't be too difficult you just check their papers and give them a stall and ?? it's very simple and that really brought me back with the contestants rea;;y brought me back and so it was something I totally enjoyed and all this weekend people have said over and over and over we missed you so much and it's kinda hard to grasp I never realized it really, people really did care and do care and I;m so, it's been wonderful wonderful weekend to be back into this and I'm jumping into this and i'm jumping right back into it, course I'm not gonna be quite as involved as it was before but I've submitted my name to be back on the finals committee I told them I says I'll do anything on the committee just don't make me rodeo director again, been there done that and don't wanna go through that again cause it's not easy it's a lot of responsibility and a lot of pressure and you know with our rodeos starting to struggle in 2 thousand, probably about 2010 or 11 starting climbing and everything else it was becoming more and more difficult and fortunately the rodeo I was rodeo director of finals was wasn't as successful it was really hard for  it was really hard for me it didn't it wasn't as successful as I wanted it to be but it was happening and we're happening right now and I tried I've served on various committees probably almost very committee you could possibly think of and I've been trying to preach that with the difficult of getting sponsors and everything else we need to rather than create new associations and they jump in and do rodeo first year and they don't know what they're doing and they don't know and don't realize and they end up losing a lot of money and unfortunately some have folded and I am pushing and I'm continuing to push that associations work together, come together and we had 4 associations that were the GPR GReat PLanes ROdeo, 4 associations, Kansas Oklahoma Little Rock and Missouri and the rodeo rotated it rotated to the different cities and it worked and that was at the time when the rodeos were successful and then they eventually went off and did their won rodeos and that's what I'm trying to get back again cause we have little associations that are struggling, struggling to stay alive, stay in business and it's very disheartening when we lose one, so I;m gonna try to continue to push for the coming together not being feel like you wanna be independent do your own thing because its hard its not east and some rodeo budgets *cough* excuse me, our... finals budget can run anymore from 150 to 250 thousand dollars,budget and its hard, is very hard cause see what the contestants put in at finals they have put in a percentage all year long towards, towards the finals rodeo and then their fees for the finals rodeo itself and what's been participated this all comes into the big pot and every single event no matter how many people, how many people are in the event the payout is the same for all 13 events, equally and the n its broken down 1st 2nd 3rd and 4th I've seen bronc riders bull rider s that that's all they do their the only ones that cover and they walk away, I've seen them walk away with 3600 dollars for 2 rides but it is a big thing but even the nits becoming more and more of a struggle like I said we don't do this there's no intention of being professionals, some of our members are ??? card holders because they do other professional events roping events barrel racing you know those different things but we, ours is recreation and its more it's more than just the rodeo it's the camaraderie the chance to see friends be together spend a weekend together",mentor,
,RS,"So with you getting started in 1988 were you, did you experience the cancellation of the 1988 finals when it was supposed to take place, I believe in Nevada and then all of a sudden it got canceled?",homophobia,
,PT,"I'm not quite sure it was 1988, I believe it was earlier than that, I would have to go back and look but ya.",homophobia,
,RS,Did you experience any sort of Homophobia on the circuit?,homophobia,
