timestamp,speaker,words,tags,
,PT,"Ya we did, PETA used to protest a lot of our rodeos so we had to deal with that but they had their limits on where they could protest and we just did not let that effect that and get to us cause we have a very strong, how would you say rules or guidelines for animal safety and we thrive on that because that it is so important to us, and part of you know the mission of IGRA and everything is for the country western lifestyle but we also want to preserve and there's no, we don't tolerate abuse of animals.",homophobia;peta,
,RS,How do you think the culture has changed overarchingly in terms of homophobia?,homophobia,
,PT,"Oh I think it's changed I think it's becoming much easier. With legal gay marriage is becoming legal now and more and more and everything its, its changed a lot and it's a lot more comfortable, and that I've always said that my brother was very difficult, because that was not that was during an era in the 70's, that it was not accepted and you had to be very careful, and there was a lot of hate and everything going on and you just really and, you know you really had to be careful and a lot of people, remained in the closet or very isolated because they were so scared. And nowadays it's much more accepted and everything else but the one thing about our rodeos too is that we have never ever, turned someone down for their race their sexual orientation, anything we have straight couples compete in our rodeos we have a couple this weekend competing and we have always with open arms invited them in and the first thing they say after they competed one day is this is unbelivable and everyone is so wonderful and so nice and they say it's a much nicer atmosphere and so we're really proud of that that we're able to bring that out into the community and open it up to anybody, and I mean we do not discriminate we're even working on now trying to get kids now involved the problems we have is the legal age and stuff like that so currently kids cannot, depending on what the legal age is the state cannot compete, but we're getting we've gone in the direction now that the associations CGRA has is we have junior members and they come to jaconos and other events that aren't sanctioned and come to the rodeos and watch their friends and or family members compete, I mean a lot of kids come that their parents are competing. It's really, it's a very gratifying very satisfying feeling and it also you know, it's just become so much easier and I said, you know, I was so blessed, to come out when I did not only did my brother pave the path with my family but my, but it also you know, it was at a time where it was getting much better and it continued to get better all the way up to today, it becomes much more acceptable there were times in the early years that we were a little fearful when we went into cities we had to be very careful, we had to be very careful, we didn't allow people to go out by themselves wwe had to be very careful because of the acceptance of being gay lesbian transgender, and I think it's, I think its continuing to become more and more acceptible, and I belive that's happening around the world as well, countries around the world that have never acknowledged women are now acknowledging women, gays are no longer being torchered and murdered for being gay, and it's a good thing, I feel very proud to be a gay man, living in the 21st century.",homophobia,
48:24:00,RS,"Now could you describe what you did as the administrative assistant for those 10 years, what did that job look like?",jobs,
,PT,"I was a lot like the liason for the contestants, the contestants would call the office if they had a problem with registration they couldn't get registered everything else they'd call, that's the one thing I did do that's still continued to happen is I gained the respect of them because I listened to them, and I helped them, get better or get through the obstacles that they needed.",jobs,
,RS,And the physical office was in Charlie's?,jobs,
,PT,"Yes, yes the initial it started in 1991, Wayne created this position, it was another bartender that was at Charlie's and he started, Ricky Joe Newly and he was the administrator for 2 years and then he got sick so at the time he did Wayne said okay here's your opportunity go. So I interviewed at the finals rodeo, no the Texas rodeo in 1992 and started January 1st 1993 for 10 years, and that was wonderful wonderful thing if I were ever to get the opportunity to go back I would do it in a heartbeat and it would be because of the contestants.",jobs,
,RS,And were you mainly doing most of your work at the time via telephone and mail?,jobs,
,PT,"A lot of it was mail, smail mail and telephone, internet was beginning at the time but a lot of it was snailmail or telephone",jobs,
,RS,Did you ever get an email address?,jobs,
,PT,"I did, I did, I got it during my time and I still have it, I have an account its IGRA@att.net but its still one of my own personal accounts so yes I did, and when I was an administrative assistant I had one administrative assistant @ igra .com and then I had one when I was trustee for Colorado I had different emails so I did. I get to experience the beginning, the real beginning and the popularity of email and much easier way of translation.",jobs,
,RS,And was that your full time job or were you doing that in addition to other things?,jobs,
,PT,"It was a part time job, it was, let me see how many hours was it, about 30 hours a week. And then I worked in conjunction with, working at Charlie's as a bartender, DJ and all that so my office was downstairs in the basement. So sometimes I'd come in and work up until it was time for me to go upstairs and go to work and do that but it gave an, and this is exactly what Wayne wanted, it gave an avenue for contestants to be able to go, when you couldn't necessarily go through your association because for various reasons you had an avenue to go that would help you, and I believe today it still has gone on. And Tommy Channel when he took over my position in 2003 and is currently in the position, lot of things have changed, the office is no longer there, it's all done remote, Tommy works out of his house and everything else but, and he just received on thursday, thursday night no, friday night, last night he received the Wayne Jakino, western lifestyle buckle and I've won various buckles across the year, my most favorite one is of course my hall of fame buckle, I wear that very proudly, but I wear other ones too but, that's one I do not have yet and I hope someday before I die that I will get that because Wayne paved the way for me, he pushed me into all this I wouldn't be here today if it wasn't for him and he was just like another a dad to me, and it just was so hard you know, it's hard to describe just how we just bonded so well.",jobs,
,RS,Can I ask what the western lifestyle means to you?,cowperson,
,PT,"Western lifestyle in my opinion is the beginning of the west you know, the beginning of cowboys and indians, you know. That was the start the was the beginning of the United States and it could have even been the beginning in other countries but it was really United States where western cowboys and indians started they were fighting against each other and then later on you know and now to this day get along and I don't know if you were there for grand entry today when they blessed that was very moving that was unbelievable i was just like wow just to be there in that and face the different directions and she would bless the directions and they all had north east south west all had meanings it was it was quite the experience I thought it was just amazing I told the person in charge of getting that that was just amazing it really was.",cowperson,
,RS,So do you consider yourself a cowboy?,cowperson,
,PT,"Yes, I always have, I always have I've always worn the jeans, the cowboy hat, everything else, and I ironically I'm the only one in my family that does, nobody else did. My father grew up on a farm in Iowa, he was basically on his own at 14 he had 10 siblings, actually he had 11 siblings initially and 2 died so then it was him and 9 siblings there are 2 of them left but he grew up there in a farm so I attribute some of the to him being that way. My mom was pure city slicker, she was born in Salt Lake City, wasn't even there a few days and was in Colorado to Colorado recognizes her as a, I am a third generation native because they recognize her as a native cause she spent most of her life here in Colorado so, yes my family comes from Fairplay area. I have a lot of relatives that are barried up in outside of Fairplay in Alma and we, when we have a death, we cremation we, we go as a family, we go up and spread the ashes the same place where we've done all the others and we've even marked a tree so we know we have the same place and it's something that our family does that just, it's just what we do and it means so much because it goes back to where our roots and were my great grandfather was and grandmother.",cowperson,
57:40:00,RS,So did you leave Charlie's at the same time you left the administrative position?,jobs,
,PT,"No, no I continued at Charlie's and worked there up until I left there in 2000 I met my partner at the time, we met by mutual friends in Puerto Vallarta hit it off right away and dated for 6 months and the I moved to Colorado Springs, he had just taken over, him and his brothers had just taken over his father's business of a 30 year painting business very reputable, they don't have to advertise because they have all these people from before that return so it's quite the deal so when my partner and I Craig talked about it, you know he said I said you know what? I'll go. I'm ready to go. I'd been in the bar business 15 years and that was it was enough, it was enough, and I just really wanted a relationship that I thought was going to be forever, unfortunately it was not but and part of it was my fault because I was so heavily involved in rodeo and travelling so much that my partner strayed and therefore, but I left 2012, moved back to Denver, lived with my friends for a year and then my Mom and I moved in together and I started taking care of her as she started getting progressing and getting older and she's getting pretty frail, and probably we're gonna have to put her into a, some kind of assisted living or nursing home in the next 6 to 8 months because it's gotten to the point I can't and she needs medical assistance. And so, once again I'll be out on my own but I'm ready to do a little bit different that typically what people do, I want to be, I worked up I just left July 22nd, I worked up the Jefferson County fairgrounds in Golden Colorado, I was the campground supervisier it was a position that this director had created with specifically with me in mind running cause he had seen how I had done when I was barn manager for CGRA rodeos and he wanted it to happen so he created the position I was there 15 months, before I had to resign because I was having medical issues and I just was worn out and also having problems with, which was my very good friend and we had become very good friends and unfortunately it clashed. But during that time I was, I had attained a trailer, a 5th wheel small 5th wheel, cause I stayed in it sometimes if we had events going over the weekends and you know gonna be that long hours and all that so I had it and with the help of  2 of my very dear friends, I was able to get that 5th wheel and did that, well during that time it convinced me that's the way I wanna live, I wanna live, I was the campground supervisor and it just was loved the people, the stories, oh my gosh people from all over the country even out the country, you know they come to camp and everything else and hearing their stories and everything else and it's becoming more and more people and not just older people, but younger people are living full time in their RVs, and so I you know of course even though I left Jefferson County fairgrounds I've been told I'm always welcome to come back and so I definitely wanna be a camp host because I can do volunteer, not have to pay rent because for volunteering its in exchange, then and I can still do the rodeos cause I'm back and I told them today, I told alot of them today, I'm not going away, I'm not going anywhere, so.",jobs,
 ,RS,So when you took the last 2 years off was that really sort of focus on your health?,,
,PT,"Partially, but partially I just needed a break, cause I had gone non-stop and you know, through losing a relationship, partially to my involvement with rodeo and commitment. Not that my commitment wasn't there but it's difficult because I traveled a lot and so then he",,
,RS,And he wasn't interested,,
,PT,"Oh no, I tried to get him interested once and boy was that the wrong thing to do, he just didn't care for that. And in the beginning he supported me completely but I just got too involved but I didn't realize until it was too late how involved I was. And so I took the 2 years just to get a break away form it but also because I was working full time up at even though it was part time it wasn't I was working very much full time but only getting paid part time, which was okay with me because of my being on disability I can only make so much a month so it wasn't the money issue it was the job and I loved it, and I would go back in a heartbeat I would go back to it, if offered that, but even if I don't I'm welcome to come back as a camp host and do that, so I'm looking forward to that, it's very unfortunate we have to do what we have to do with our mom, but it's part of it so I kinda get my independence back because it's been interesting.",,
,RS,Its difficult,,
,PT,Ya I love my mother to death but it's been tough,family,
,RS,Do your other siblings help at all?,family,
,PT,"My younger sister does, my older brother doesn't help too much but its my younger sister and I.",family,
,RS,It's a lot of work.,family,
,PT,Can we take a little break.,,
Start 2nd,RS,"Alright, we are back here with Patrick Terry and I was wondering if you would be willing to talk a little bit about the effort that went into building the amazing archive that you helped donate to the Autry National Center?",,
,PT,"I, when I was a competitor I always kept the programs I kept them myself and everything else so I had accumulated boxes, then when I went into the office, I was still competing, but you know, I was going and having access to and getting rodeo associations to send me their programs, advertising posters, everything. And I went into the office and said you know what? And it had been somewhat collected prior to that but it was mainly throw it into a box, was not organized and I you know I'm a very organized person and probably went a little overboard, I started arranging it, and then I thought you know what? This stuff is gonna come back someday it's gonna be important, someday it's gonna to be beneficial I know it will that maybe not while i'm alive but I hope that people that continue on after me will continue to collect it. So I started collecting and putting it all together organizing it get it all in order by year, by rodeo. And started doing that when I went in the office you know, heavy contacting all the associations telling them they had, weather I went to the rodeo or not I told them that they had to send me the program the advertising their flyers their posters, we used to do a poster mailout CGRA used to do a poster mailout to bars, organizations, all across the country, and each association would submit their poster and we collected, we'd get them all and then we'd put them all into tubes and mail them out, CGRA did. So we have that was going, so we had accumulated lots of posters, I'd accumulated quite a bit and you know put em up on the top shelf someday and everything else. But then when full force getting as much as I could from the rodeos and or events that the associations had put on. And it, it was fun. I loved it. And I knew that someday it would be, so then through the relationship that we built with Gregory Hinton, he came to Charlie's and we have, we were going to ship archives, well, I wanted to retain some for IGRA for the international, and so, it was kinda interesting when we met and we started going through it Gregory wanted to take it all and I wouldn't, and so Brain Helander was the president at the time and he got kinda, became the referee for, and he said, his words were Patrick is entitled to keep whatever he wants. Then whatever will go to the archives. and so Gregory wasn't to happy with me about that but it worked out. So, we went through all of it, all of it by year, I had it all in order by year we went through every single one, if there were duplicates I would keep one, one would go to them, maybe two or three. Because I was collecting about 4 to 6 programs from every rodeo and as much as a flyer and all that stuff. So I was doing all that, and so we went through all of it, 3 days, took us 2 days, 3 days.",,
,RS,And where was it stored?,,
,PT,"It was in Charlie's in the basement of the administrative IGRA office. And it was all there, in these big heavy duty shelves and I had put them all into these large really long, file boxes. And had them all in order by year, by rodeo blah blah blah. And so I had them, so by the time Gregory and I finished going through, I kept what, I felt, IGRA should have. And then we sent the others and Tommy Channel and myself drove to Erving California and... put together, I mean, sit with us we had to actually get a special... SUV large SUV, a suburban because the weight, there were 22 of those boxes full to the brim, of programs, flyers, everything you could possibly think of IGRA. And so when Gregory had approved us and said the opportunity was due it was the same time Brokeback mountain had just came out, and so the understanding we had was it was gonna go on display right away and when we arrived there I had to sign off on there, meaning it was no longer our property but theirs, and it was difficult. I had a real difficult time signing that piece of paper. I hesitated and hesitated and said you know what I don't know if I can do this. But then I kept thinking for the future of people and studying, researching as yourself, and doing this it will benifit. So I finally signed the piece of paper, I have to this day still have that piece of paper that I kept myself took a copy and put it in the archives but I kept the one I signed, to myself and, I just you know we dropped that off so we were anticipating it was gonna go on display, fairly quickly and I don't know if you've talked with Gregory in depth and everything else but at the time the Brokeback mountain the two guys shirts had been donated some guy bought them and didn't know what to do with them but he had wanted to but them, I think they said he paid 40 thousand dollars for them, so he donated them to the Autry with the understanding, that they were going to be displayed immediately, and so that's where we thought our archives were gonna go in conjunction with that and we're gonna be displayed. Unfourtunatly that didn't happen it took a few years for them to archive it and catalog it all and everything else and we had people from associations if they were in Burbank California area that they would go to, but and they never allowed, never anything was allowed to leave the Autry, it was never allowed to leave the library you checked it out but you could only do your research right there you could not take it home with you there was nothing to take. Unfortunately the archives was never really fully displayed, but there was a, like a ceremony and everything else and Mrs. Autry was there, unfortunately I wasn't able to make the event but I, it was okay, everybody knew, that I had done this, and that was probably one of the biggest highights of my entire time with IGRA. It was so gratifying, and just the whole idea that I knew someday somewhere, that it would come into play. And you know, people have researched, people have gone and researched. We did have, some of ours was on display for a while I don't know that it still is but you know, so it was a little disappointing that we anticipated i'd go farther than it did, but the fact is, it's all cataloged it's all there, at the Autry museum and Mrs. Autry was so, she could not get over, she said I have never seen any organization that kept so many things, you know? And archived them and I said... and I was. So she congratulated me on doing that and send it through people. She told me, and that to me was the top of the, here was all that it had come to fold and had come, it was now going to be put to use, rather than sitting in the boxes in the closet down at the office at Charlie's. In the basement it, but yet we still had ours.",,
,RS,"So, one thing that really struck me going through the archives was that a lot of people when they do archive rodeo things, they do flyers and they do programs but they don't do, filing of complaints, or they don't keep stock contractor agreements, they don't keep that sort of business side, and I'm wondering how you decided which of those sort of those business end of things to keep in the archive?",,
,PT,"Well I mean it was more of the how International Gay Rodeo Association Board felt about it, whether or not they wanted that released, because of people at the times, it was just starting to get better, but people's names and everything else were associated and they wanted to remain anonymous so we were, we had an obligations to our members to keep that quite, keep that as quiet as possible. So therefore it was difficult to pass on that stuff, we kept all of it, and still have it, and it's currently being stored up in a semi trailer bed that we share with the Colorado Gay Rodeo Association, the International does in storing in this big semi trailer.",,
,RS,And for the pieces you've kept that's really helped Frank Herel construct his online archive.,,
